{
  "contractVersion": 1,
  "correlation": {
    "requestId": "req-0001",
    "userId": "user-0001",
    "sessionId": "sess-0001",
    "taskId": "task-0001"
  },
  "toolCallId": "call-0001",
  "toolName": "browser.navigate_extract_and_discover",
  "arguments": {
    "url": "https://shop.example.com/products",
    "goal": "compare prices for wireless headphones"
  }
}
